page,text
64,"66 CUSTOMS BULLETIN AND DECISIONS, VOL. 58, NO. 38, SEPTEMBER 25, 2024 Nonetheless, the Federal Circuit has made clear that Katana is “entitled to assert any and all defenses to the government’s claims for unpaid duties,” including its claims that it was the victim of identity theft. Katana II, 75 F.4th at 1354. Such defenses, however, entail fact-based inquiries that are not suited for resolution at the threshold stage of this proceeding. For purposes of its claim, the government properly alleged the “person” within the meaning of a 19 U.S.C. § 1592(a) violation. Katana’s motion to dismiss on the grounds of the government’s failing to name the “person” in its initial complaint is denied. C. The government was not required to exhaust administrative remedies prior to filing suit. The next issue is whether the government was required to exhaust administrative procedures pursuant to 28 U.S.C. § 2637(d) prior to filing suit for a 19 U.S.C. § 1592(d) claim. In remanding the case, the Federal Circuit held that, Katana will not be able to argue that Customs was required by statute to follow the penalty assessment procedures set forth in 19 U.S.C. § 1592(b). As the government argues and as Katana recognizes, such procedures were not statutorily required. Sec- tion 1592(b) provides the applicable procedures for issuing a pre-penalty and penalty notice in the event the government seeks to collect penalties for a violation of § 1592(a). In contrast, § 1592(d) explains that “the Customs Service shall require that ... lawful duties, taxes, and fees be restored, whether or not a monetary penalty is assessed.” 19 U.S.C. § 1592(d). Thus, when a penalty is not assessed, as here, the statute does not mandate the performance of the procedures under § 1592(b). Katana II, 75 F.4th at 1354 (emphasis in original). The Federal Circuit has held that the government’s claim for un- paid duties under 19 U.S.C. § 1592(d) does not require the perfor- mance or exhaustion of the administrative procedures under 19 U.S.C. § 1592(b). Katana has not alleged what additional adminis- trative procedures might be required beyond those set forth in sub- section (b).1 As such, it would be inappropriate for the court to create further administrative procedure requirements through application 1 Instead, Katana again alleges that “[w]hile [...] Customs is not required to follow the elaborate procedures of § 1592(b) when asserting a claim for withheld duties, it must articulate that there was a culpable violation of § 1592(a).” Def.’s Mot. at 10. As previously discussed, Customs has alleged a culpable violation of 19 U.S.C. § 1592(a)."
65,"67 CUSTOMS BULLETIN AND DECISIONS, VOL. 58, NO. 38, SEPTEMBER 25, 2024 of the catch-all provision of 28 U.S.C. § 2637(d). Katana’s motion to dismiss for failure to exhaust additional administrative remedies is denied. D. This claim is not barred by laches. The next issue in Katana’s renewed motion to dismiss is whether the government’s claim is barred by laches. The Supreme Court has provided guidance for determining timeli- ness of suit when Congress has specifically enacted a statute of limitations. In SCA Hygiene Prod. Aktiebolag v. First Quality Baby Prod., LLC, the Court held that, Laches provides a shield against untimely claims, and statutes of limitations serve a similar function. When Congress enacts a statute of limitations, it speaks directly to the issue of timeliness and provides a rule for determining whether a claim is timely enough to permit relief. The enactment of a statute of limita- tions necessarily reflects a congressional decision that the time- liness of covered claims is better judged on the basis of a gen- erally hard and fast rule rather than the sort of case-specific judicial determination that occurs when a laches defense is asserted. Therefore, applying laches within a limitations period specified by Congress would give judges a “legislation- overriding” role that is beyond the Judiciary’s power. As we stressed in Petrella, “courts are not at liberty to jettison Con- gress’ judgment on the timeliness of suit.” SCA Hygiene Prod. Aktiebolag v. First Quality Baby Prod., LLC, 580 U.S. 328, 334–35 (2017) (internal citations omitted) (quoting Petrella v. Metro-Goldwyn-Mayer, Inc., 572 U.S. 663, 667 (2014)). At oral argument, Katana was asked to explain why its argument regarding laches is appropriate given the clear directive from the Supreme Court. Oral Arg. 46:4–5, ECF No. 56. Katana failed to explain why this court should depart from the Supreme Court’s hold- ing or how the facts of this proceeding are distinguishable.2 As such, the court will not take on a “legislation-overriding” role. Katana’s motion to dismiss under a theory of laches is denied. 2 In response to questioning as to whether Katana wanted to continue its laches argument despite clear directive from the Supreme Court in SCA Hygiene Prod. Aktiebolag, counsel for Katana replied, “You know, the normal questions of laches apply; dimmed recollection, dimmed access to documents.” Oral Arg. 48:13–16."
66,"68 CUSTOMS BULLETIN AND DECISIONS, VOL. 58, NO. 38, SEPTEMBER 25, 2024 E. Katana’s assertion of affirmative misconduct is appropriately raised by motion for summary judgment. The Federal Circuit held that the court erred in dismissing the case for lack of subject-matter jurisdiction under CIT Rule 12(b)(1), and that on remand Katana has the option to either “renew its motion to dismiss under USCIT Rule 12(b)(6) or seek summary judgment.” Katana II, 75 F.4th at 1353 n.5. The Federal Circuit explained that Katana is “able to assert as an affirmative defense its claim that its third statute of limitations waiver was void.” Katana II, 75 F.4th at 1353. Specifically, a waiver may be found to be void if it is not “voluntary” or is procured from an act of “affirmative misconduct.” Id. (citing United States v. Ford Motor Co., 497 F.3d 1331,1336 (Fed. Cir. 2007); Stange v. United States, 282 U.S. 270, 276 (1931)). Thus, if Katana were able to demonstrate that the execution of its third statute of limitations waiver was procured through the government’s affirmative misconduct, it would be able to raise the statute of limi- tations as an affirmative defense to the government’s claims.3 Generally, an affirmative defense is not properly raised at the mo- tion to dismiss stage, and instead is asserted at trial or at the sum- mary judgment stage by reference to undisputed material facts. See Toxgon Corp. v. BNFL, Inc., 312 F.3d 1379, 1382 (Fed. Cir. 2002); Transamerica Premier Life Ins. Co. v. Selman & Co., LLC, 401 F. Supp. 3d 576, 588 (D. Md. 2019) (“Courts ordinarily do not ‘resolve contests surrounding the facts, the merits of a claim, or the applica- bility of defenses’ through a Rule 12(b)(6) motion.”). An exception exists, and an affirmative defense may be considered at the motion to dismiss stage when it “clearly appears on the face of the pleading.” Mobile Acuity Ltd. v. Blippar Ltd., 110 F.4th 1280, 1289 (Fed. Cir. 2024) (quoting Boquist v. Courtney, 32 F.4th 764, 774 (9th Cir. 2022) (“Ordinarily affirmative defenses may not be raised by motion to dismiss .... But a complaint may be dismissed when the allegations of the complaint give rise to an affirmative defense that clearly appears on the face of the pleading.”)). A motion to dismiss based upon an affirmative defense must be resolved by summary judgment stan- dards if it relies upon matters outside the pleadings. CODA Dev. s.r.o v. Goodyear Tire & Rubber Co., 916 F.3d 1350, 1360 (Fed. Cir. 2019) (“If a court does consider material outside the pleadings, the motion to dismiss must be treated as a motion for summary judgment under Rule 56 and all parties must be given a reasonable opportunity to 3 While Katana did not explicitly assert the claimed affirmative misconduct as an affirma- tive defense, the court will treat it as such following the Federal Circuit’s guidance. See Katana II, 75 F.4th at 1353."
67,"69 CUSTOMS BULLETIN AND DECISIONS, VOL. 58, NO. 38, SEPTEMBER 25, 2024 present all material pertinent to the motion.”); see also 5C Charles Alan Wright & Arthur R. Miller, Federal Practice and Procedure § 1366 (3d ed. 2018) (“Once the district court decides to accept matters outside of the pleadings, the presence of the word ‘must’ [in Rule 12(d)] indicates that the judge must convert the motion to dismiss into one for summary judgment.”). In its renewed motion to dismiss pursuant to CIT Rule 12(b)(6), Katana asserts that the government engaged in affirmative miscon- duct by inducing Katana to agree to a waiver of the statute of limi- tations in exchange for a promise to make a “presentation.” Def’s. Mot. at 21. Katana provides multiple exhibits in support of this affirmative defense assertion, including written statements between Customs officers and Katana’s lawyers discussing this purported pre- sentation. Def.’s Ex. at 182. In its complaint, however, the govern- ment asserted that, This action is timely pursuant to 19 U.S.C. § 1621. Katana executed a waiver of the statute of limitations for a two-year period commencing on May 15, 2014. On July 15, 2015, Katana signed a second two-year waiver that extended the period of the waiver until July 15, 2017. On October 25, 2016, Katana signed a third waiver for a period “up to and including July 15, 2019.” Compl. ¶ 4. The government’s assertion in its initial complaint is valid on its face. As such, within the context of a motion to dismiss, the court cannot consider Katana’s assertion of affirmative misconduct as an affirmative defense given the factual dispute as to whether its third waiver of the statute of limitations is void. This factual dispute relies on matters outside the initial pleading, rather than on the face of the complaint itself. Therefore, it is appropriate to analyze Katana’s arguments respecting its allegations of the government’s affirmative misconduct under the rubric of a motion for summary judgment. II. Katana’s Motion for Summary Judgment and Government’s Motion for Partial Summary Judgment Are Denied Summary judgment is proper when “the movant shows that there is no genuine issue as to any material fact and the movant is entitled to judgment as a matter of law.” CIT Rule 56(a); see also Celotex Corp. v. Catrett (“Celotex”), 477 U.S. 317, 324 (1986). The Federal Circuit has explained that the “movant bears the burden of demonstrating ab- sence of all genuine issues of material fact” and the court “must view the evidence in a light most favorable to the nonmovant and draw all reasonable inferences in its favor and must resolve all doubt over"
68,"70 CUSTOMS BULLETIN AND DECISIONS, VOL. 58, NO. 38, SEPTEMBER 25, 2024 factual issues in favor of the party opposing summary judgment.” SRI Int’l v. Matsushita Elec. Corp. of America, (citation omitted) 775 F.2d 1107, 1116 (Fed. Cir. 1985). If a genuine dispute about a material fact exists, summary judg- ment must be denied. Liberty Lobby, 477 U.S. at 248. A dispute is “genuine” only if a reasonable fact-finder could find for the non- moving party; a fact is “material” only if it is capable of affecting the outcome of the litigation. Id. The primary responsibility of the court on a motion for summary judgment is to determine whether there are any factual issues to be tried. Dan-Dee Imports, Inc. v. United States, 7 CIT 241, 243 (1984); Yamaha International Corp. v. United States, 3 CIT 108, 109 (1982); Outlet Book Co. v. United States, 11 CIT 598, 599 (1987). A. Katana’s claim regarding the government’s purported affirmative misconduct presents an issue of material fact. Because Katana’s affirmative defense alleging the government’s purported affirmative misconduct relies on arguments outside of the initial pleadings, the court now considers those arguments under summary judgment standards. Outside of the initial pleadings, Katana asserts that the govern- ment engaged in affirmative misconduct by inducing Katana to agree to a waiver of the statute of limitations in exchange for a promise to make a “presentation.” Def’s. Mot. at 21. Katana argues that it relied on this opportunity to make a presentation in order to “exonerate itself” prior to the government’s demand for payment of unpaid du- ties. Id. at 23. In support of this argument, Katana cites to a March 21, 2016, meeting where Katana’s President, General Manager and Controller, and counsel met with Customs Deputy Assistant Director Jorge A. Garcia. Def.’s. Mot. 20–21. After this meeting, and reflected in a March 22, 2016, letter, Mr. Garcia granted Katana an extension of time to tender the claimed unpaid duties and allowed Katana the “right to make presentations in response to that demand in accor- dance with 19 U.S.C. § 1618.” Def.’s Ex. at 182. Katana executed its third statute of limitations waiver on October 25, 2016. Def.’s Ex. at 186. Katana asserts that the opportunity to make a presentation was later revoked and that the affirmative misconduct is “the refusal of Customs at Detroit to honor the promise of Mr. Garcia from Los Angeles, that we would be given the opportu- nity to come in and make a presentation about the identity theft.” Oral Arg. 40:19–22. The government disagrees that there was any affirmative miscon- duct. The government presented evidence that a Customs official,"
69,"71 CUSTOMS BULLETIN AND DECISIONS, VOL. 58, NO. 38, SEPTEMBER 25, 2024 Officer Hiyama, attempted to communicate with Katana multiple times between June 24, 2018 and March 28, 2019, without a re- sponse. Def.’s Ex. at 190–91. In these communications, Officer Hi- yama asked for updates from Katana, as well as offered a “pathway to settlement.” Def.’s Ex. 190. The government additionally asserts that there was no affirmative misconduct because the right to present was available as a written submission, and “Katana recognized that it could be a written submission.” Oral Arg. 42:24. The parties’ disagreement about the events that transpired during the time period between October 25, 2016 and July 15, 2019 consti- tutes a genuine dispute about a material fact that cannot be resolved at the summary judgment stage, and without discovery. There is no single test for detecting the presence of affirmative misconduct; each case must be decided on its own particular facts and circumstances. See Dis Vintage, LLC v. United States, 40 Int’l Trade Rep. (BNA) 1089 at 18 (CIT 2018); Lavin v. Marsh, 644 F.2d 1378, 1382–83 n.6 (9th Cir. 1981). The inquiry is necessarily fact-intensive and given the parties’ disagreement about the facts surrounding Katana’s third waiver, it is improper to rule on this affirmative defense under summary judg- ment standards. Katana, however, will have the opportunity to assert its affirmative defense at trial, and both parties will have the oppor- tunity to develop a more thorough factual record through discovery. B. Katana’s claims regarding its level of culpability as a purported victim of identity theft present an issue of material fact. Also at issue before the court is the government’s cross motion for partial summary judgment seeking $5,742,483.80 in unpaid duties. The government argues that it has presented evidence which “would be admissible at trial” demonstrating the elements necessary for a 19 U.S.C. § 1592(d) claim. Pl.’s Reply at 3–7. According to the govern- ment, Katana “failed to submit evidence that would be admissible at trial to rebut these points.” Id. The government faults Katana for failing to submit an affidavit or declaration made under penalty of perjury, arguing that “Katana primarily relies on statements it made to CBP, but those statements are hearsay that would not be admis- sible at trial and, thus, do not establish any dispute of material fact.” Id. at 1. Katana disagrees, arguing that the Federal Rules of Civil Procedure were “amended a few years ago [so] you no longer have to put admissible evidence in support of a summary judgment motion.” Oral Arg. 33:20–33:21. Katana asserts that the “only requirement” at the summary judgment stage of a proceeding is a statement “which could be provided to the court at trial in an admissible form.” Id. at 33:23–33:25."
70,"72 CUSTOMS BULLETIN AND DECISIONS, VOL. 58, NO. 38, SEPTEMBER 25, 2024 Katana is correct that when considering a motion for summary judgment, the court may consider evidence presented in a form that would be inadmissible at trial. Celotex, 477 U.S. at 324 (“We do not mean that the nonmoving party must produce evidence in a form that would be admissible at trial in order to avoid summary judgment.”). The inquiry for summary judgment purposes is “whether the cited evidence may be reduced to admissible form, not whether it is admis- sible in the form submitted at the summary judgment stage.” United States v. Univar USA Inc. (“Univar USA”), 355 F. Supp. 3d 1225, 1235–1236 (CIT 2018) (quoting United States v. Sterling Footwear, Inc. (“Sterling Footwear”), 279 F. Supp. 3d 1113, 1124 (CIT 2017)); see also United States v. Harvic Int’l, Ltd., 427 F. Supp. 3d 1349, 1356 (CIT 2020). The government relies on the hearsay rule as the basis for its summary judgment argument. Pl.’s Reply at 3–7. Hearsay is an out-of-court statement offered “to prove the truth of the matter as- serted in the statement.” Fed. R. Evid. 801(c). Hearsay is inadmis- sible at trial unless a federal statute, Federal Rule of Evidence, or other rule “prescribed by the Supreme Court” provides otherwise. Fed. R. Evid. 802. Nonetheless, a court “may consider a hearsay statement in passing on a motion for summary judgment if the state- ment could be reduced to admissible evidence at trial or reduced to admissible form.” Sterling Footwear, 279 F. Supp. 3d at 1124–25 (2017). Cf. CIT Rule 56(c)(2). Here, the email statements made by Katana’s employees regarding its claims of identity theft as a defense against culpability may be hearsay to the extent that they are used to prove the truth of the matter asserted.4 See Fed. R. Evid. 801(c). However, “[t]he most obvious way that hearsay testimony can be reduced to admissible form is to have the hearsay declarant testify directly to the matter at trial.” Sterling Footwear, 279 F. Supp. 3d at 1124–25. Counsel for Katana stated that with respect to these statements, “there’s an author and a recipient of the email; they could be made to testify at trial.” Oral Arg. 34:3–34.5. The government has made no indication that these individuals would not be able to testify at trial. As such, irrespective of the government’s arguments regarding the form of the statements, the content of Katana’s statements indicates that there is a genuine dispute as to one of the most significant material facts of the case: the person or entity who is liable under 19 U.S.C. § 1592(a) for the claim of unpaid duties under 19 U.S.C. § 1592(d). Summary judgment is not appropriate when such a signifi- cant material fact is in dispute, and CIT Rule 56 was not meant or 4 The court makes no finding regarding the admissibility of such statements as hearsay."
71,"73 CUSTOMS BULLETIN AND DECISIONS, VOL. 58, NO. 38, SEPTEMBER 25, 2024 anticipated to be used in such manner. See Univar USA, 355 F. Supp. 3d at 1235–1236. Both Katana’s motion for summary judgment in the alternative and the government’s motion for partial summary judgment are therefore denied. CONCLUSION For the foregoing reasons, Defendant’s motion to dismiss is DE- NIED; Defendant’s motion for summary judgment in the alternative is DENIED; and Plaintiff’s motion for partial summary judgment is DENIED. It is ORDERED that both parties are hereby directed to file with this court within forty-five days of the date of this order an amended Joint Status Report and Proposed Scheduling Order. With- out intimating any view on the merits, the court encourages the parties to conduct a good faith attempt to settle this matter prior to trial. Dated: September 9, 2024 New York, New York /s/ Lisa W. Wang LISA W. WANG, JUDGE"
72,"74 CUSTOMS BULLETIN AND DECISIONS, VOL. 58, NO. 38, SEPTEMBER 25, 2024 Slip Op. 24–101 SEA SHEPHERD NEW ZEALAND and SEA SHEPHERD CONSERVATION SOCIETY, Plaintiffs, v. UNITED STATES; GINA M. RAIMONDO, in her official capacity as Secretary of Commerce; UNITED STATES DEPARTMENT OF COMMERCE; JANET COIT, in her official capacity as Assistant Administrator of the National Marine Fisheries Service; NATIONAL MARINE FISHERIES SERVICE; JANET YELLEN, in her official capacity as Secretary of the Treasury; UNITED STATES DEPARTMENT OF THE TREASURY; ALEJANDRO MAYORKAS, in his official capacity as Secretary of Homeland Security; and UNITED STATES DEPARTMENT OF HOMELAND SECURITY, Defendants, and NEW ZEALAND GOVERNMENT, Defendant-Intervenor. Before: Gary S. Katzmann, Judge Court No. 20–00112 [ The Parties’ Stipulation and Proposed Order of Voluntary Dismissal with Preju- dice was filed under USCIT Rule 41(a)(1)(A)(ii). The proposed order is issued, and the case is dismissed. ] Dated: September 11, 2024 Lia Comerford, Earthrise Law Center at Lewis & Clark Law, of Portland, OR, for Plaintiffs Sea Shepherd New Zealand and Sea Shepherd Conservation Society. Stephen C. Tosini, Senior Trial Counsel, Commercial Litigation Branch, Civil Di- vision, U.S. Department of Justice, of Washington, D.C., for Defendants United States, Gina M. Raimondo, in her official capacity as Secretary of United States Department of Commerce; Janet Coit, in her official capacity as Assistant Administrator of her the National Marine Fisheries Service; National Marine Fisheries Service; Janet Yellen, in her official capacity as Secretary of Treasury United States Department of the Trea- sury; Alejandro Mayorkas, in his official capacity as Secretary of Homeland Security; and United States Department of Homeland Security. With him on the brief were Brian M. Boynton, Principal Deputy Assistant Attorney General, and Patricia M. McCarthy, Director. Of counsel was Jason S. Forman, Office of the General Counsel, National Oceanic and Atmospheric Administration, of Silver Spring, MD. Warren E. Connelly, Robert G. Gosselink and Kenneth N. Hammer of Trade Pacific PLLC, of Washington, D.C., for Defendant-Intervenor New Zealand Government. OPINION AND ORDER Katzmann, Judge: The court returns to the case of the critically endangered Maui dolphin—one of the world’s smallest dolphins—that is endemic to the waters of New Zealand. See Sea Shepherd N.Z. v. United States (“Sea Shepherd I”), 44 CIT __, 469 F. Supp. 3d 1330 (2020), ECF No. 38; Sea Shepherd N.Z. v. United States (“Sea Shepherd II”), 46 CIT __, 606 F. Supp. 3d 1286 (2022), ECF No. 108; Sea Shepherd N.Z. v. United States (“Sea Shepherd III”), 47 CIT __, 611 F. Supp. 3d 1406 (2023), ECF No. 131; Sea Shepherd N.Z. v. United States (“Sea Shepherd"
73,"75 CUSTOMS BULLETIN AND DECISIONS, VOL. 58, NO. 38, SEPTEMBER 25, 2024 IV”), 47 CIT __, 639 F. Supp. 3d 1367 (2023), ECF No. 136; Sea Shepherd N.Z. v. United States (“Sea Shepherd V”), 48 CIT __, 693 F. Supp. 3d 1364 (2024), ECF No. 153. Sea Shepherd New Zealand and Sea Shepherd Conservation Society (“Plaintiffs”) initiated this law- suit in 2020 with the fundamental claim that as a result of incidental capture (“bycatch”) in gillnet and trawl fisheries within their range, the Maui dolphin population is declining such that a U.S. ban on importing certain fish and fish products from New Zealand is re- quired by the Marine Mammal Protection Act (“MMPA”). See First Supp. Compl. ¶¶ 1–4, Nov. 24, 2020, ECF No. 46. Defendants the United States and constituent agencies and officials (“United States”) and Defendant-Intervenor New Zealand Government (“New Zea- land”) have long opposed Plaintiffs’ central claim, maintaining that New Zealand’s standards satisfy the MMPA. The stakes of this case are high. With only 43 remaining dolphins by recent estimates,1 the Maui dolphin is on the brink of extinction. As discussed in greater detail below, developments over years of litigation in this case have reflected the parties’ collective view of the urgency of the situation. In November 2022, the court issued a pre- liminary injunction banning the importation of certain fish products from New Zealand. The court lifted that injunction after the U.S. National Oceanic and Atmospheric Administration (“NOAA”) found in January 2024 that “effective for the period from February 21, 2024, through December 31, 2025, New Zealand had established that its fisheries’ measures for reducing the bycatch of Maui dolphins satisfy the provisions of the MMPA.” Sea Shepherd V, 693 F. Supp. 3d at 1367. The court did so on the motion of New Zealand, with the consent of the United States, and with no opposition by Plaintiffs. The parties have now filed a joint stipulation of dismissal with prejudice under USCIT Rule 41. See Stipulation and Proposed Order of Voluntary Dismissal (“Notice of Dismissal”), August 23, 2024, ECF No. 162. The case is accordingly dismissed by operation of the parties’ Notice of Dismissal. The court retains jurisdiction to enforce fees and costs. BACKGROUND Recognizing the seriousness of the interests at stake, the court pauses to recount the history of the litigation and outline the current state of affairs. In doing so, the court presumes familiarity with the background of this litigation as outlined in prior opinions. See Sea Shepherd I, 469 F. Supp. 3d 1330; Sea Shepherd II, 606 F. Supp. 3d 1286; Sea Shepherd III, 611 F. Supp. 3d 1406; Sea Shepherd IV, 639 1 See infra note 10 and accompanying text."
